{
  "legalEntityFinancialMeans": {
      "outstandingFines": true,
      "tradingMoreThan12Months": true,
      "numberOfEmployees": 10,
      "grossTurnover": 10,
      "netTurnover": 10
    },
  "legalEntityDefendant": {
      "name": "test",
      "address": {
        "address1": "14 Tottenham Court Road",
        "address2": "London",
        "address3": "England",
        "address4": "UK",
        "address5": "Greater London",
        "postcode": "W1T 1JY"
      },
      "contactDetails": {
        "email": "criminal@gmail.com",
        "home": "02087654321"
      },
      "position": "DIRECTOR",
      "incorporationNumber": "C123232"
  },
  "offences": [
    {
      "id": "ecf30a03-8a17-4fc5-81d2-b72ac0a13d17",
      "plea": "NOT_GUILTY",
      "notGuiltyBecause": "I was forced to do it"
    }
  ],
  "witnessDispute": "They are lying",
  "witnessDetails": "My mate Dave",
  "interpreterLanguage": "French",
  "speakWelsh": false,
  "unavailability": "I'm on holiday November 17 to 19",
  "financialMeans": {
    "income": {
      "amount": 200.25,
      "frequency": "MONTHLY"
    },
    "benefits": {
      "claimed": true,
      "type": "jobseekers allowance",
      "deductPenaltyPreference": false
    },
    "employmentStatus": "my employment status"
  },
  "outgoings": [
    {
      "description": "Accommodation",
      "amount": 500.30
    },
    {
      "description": "Council Tax",
      "amount": 120.50
    },
    {
      "description": "Household bills",
      "amount": 50.80
    },
    {
      "description": "Travel expenses",
      "amount": 100.10
    },
    {
      "description": "Child maintenance",
      "amount": 500.20
    },
    {
      "description": "Other",
      "amount": 500.40
    }
  ]
}
